{"$id":"https://outerheavenx.github.io/citadel-of-vesper/schemas/boss.schema.json","$schema":"https://json-schema.org/draft/2020-12/schema","additionalProperties":false,"description":"Boss definition. All bosses are original \u2014 never recreate Castlevania bosses.","properties":{"arenaRoomId":{"type":"string"},"attacks":{"description":"Attack patterns; each must be telegraphed.","items":{"additionalProperties":false,"properties":{"id":{"type":"string"},"name":{"type":"string"},"telegraph":{"type":"string"}},"required":["id","name","telegraph"],"type":"object"},"type":"array"},"entrance":{"description":"Entrance sequence descriptor.","properties":{"banner":{"type":"string"},"cameraLock":{"type":"boolean"},"duration":{"type":"number"}},"type":"object"},"hp":{"minimum":1,"type":"integer"},"id":{"pattern":"^[a-z0-9_]+$","type":"string"},"level":{"minimum":1,"type":"integer"},"lore":{"type":"string"},"music":{"type":"string"},"name":{"type":"string"},"optional":{"type":"boolean"},"phases":{"description":"Phase changes at HP thresholds (1.0 = full HP).","items":{"additionalProperties":false,"properties":{"addsAttacks":{"items":{"type":"string"},"type":"array"},"hpThreshold":{"maximum":1,"minimum":0,"type":"number"},"phase":{"minimum":1,"type":"integer"}},"required":["phase","hpThreshold"],"type":"object"},"type":"array"},"reward":{"additionalProperties":false,"properties":{"abilityId":{"type":"string"},"itemId":{"type":"string"},"xp":{"type":"integer"}},"type":"object"},"stats":{"additionalProperties":false,"properties":{"attack":{"type":"number"},"defense":{"type":"number"}},"required":["attack","defense"],"type":"object"},"title":{"description":"Epithet shown on the boss banner, e.g. Warden of the Gate Chapel.","type":"string"},"spawn":{"description":"Arena spawn point (feet). Defaults to room center / floor.","type":"object","additionalProperties":false,"properties":{"x":{"type":"number"},"y":{"type":"number"}},"required":["x","y"]},"hurtbox":{"description":"DamageSystem hurtbox registered with HitboxSystem.","type":"object","additionalProperties":false,"properties":{"w":{"type":"number"},"h":{"type":"number"},"offsetX":{"type":"number"},"offsetY":{"type":"number"}},"required":["w","h"]},"locomotion":{"description":"Movement style interpreted by src/bosses/Boss.js.","type":"string","enum":["walk","hover"],"default":"walk"},"tint":{"description":"Placeholder-art tint (decimal RGB) until Wave 5 art lands.","type":"integer"},"sprite":{"description":"Art sprite id; animation texture keys are '<sprite>_<idle|attack|hurt|die>'. Falls back to the boss id.","pattern":"^[a-z0-9_]+$","type":"string"}},"required":["id","name","title","level","hp","stats","arenaRoomId","attacks","phases","entrance","reward","music","lore"],"title":"Boss","type":"object"}
