[{"arenaRoomId":"moonlit_gate_014","attacks":[{"id":"chapel_slam","name":"Chapel Slam","telegraph":"raises both arms, candlelight flares"}],"entrance":{"banner":"Chapel Warden","cameraLock":true,"duration":2.0},"hp":300,"id":"chapel_warden","sprite":"chapel_warden","level":6,"lore":"It was built to guard the gate chapel's dead. The dead are gone. The guarding remains.","music":"boss_theme_1","name":"Chapel Warden","optional":false,"phases":[{"hpThreshold":1.0,"phase":1},{"addsAttacks":["bell_toll"],"hpThreshold":0.5,"phase":2}],"reward":{"abilityId":"moonrise_leap","xp":500},"stats":{"attack":17,"defense":8},"title":"Warden of the Gate Chapel","spawn":{"x":700,"y":240},"hurtbox":{"w":64,"h":96,"offsetX":0,"offsetY":-48},"locomotion":"walk","tint":14263361},{"arenaRoomId":"hollow_keep_010","attacks":[{"id":"matriarch_sweep","name":"Matriarch's Sweep","telegraph":"drags her train across the floor, dust rises"},{"id":"grief_volley","name":"Grief Volley","telegraph":"lifts her lantern high, light gathers"}],"entrance":{"banner":"Sable Matriarch","cameraLock":true,"duration":2.5},"hp":900,"id":"sable_matriarch","sprite":"sable_matriarch","level":12,"lore":"She ruled the Hollow Keep in the Living Citadel and never left it. The Ruin remembers her either way.","music":"boss_theme_2","name":"Sable Matriarch","optional":false,"phases":[{"hpThreshold":1.0,"phase":1},{"addsAttacks":["lantern_call"],"hpThreshold":0.66,"phase":2},{"addsAttacks":["throne_quake"],"hpThreshold":0.33,"phase":3}],"reward":{"itemId":"moonsteel_sabre","xp":1500},"stats":{"attack":26,"defense":12},"title":"Matriarch of the Hollow Keep","spawn":{"x":700,"y":240},"hurtbox":{"w":56,"h":88,"offsetX":0,"offsetY":-44},"locomotion":"hover","tint":5917306}]